name,lat,long,formatted_address,types
PT. Wuling Motors Indonesia,-6.3842576,107.1882347,"Greenland International Industrial Center (GIIC) Blok BA No. 1, Jl. Tol Jakarta - Cikampek No.No, Sukamahi, Kec. Cikarang Pusat, Bekasi, Jawa Barat 17530, Indonesia","['point_of_interest', 'establishment']"
Wuling Serpong,-6.2585041,106.6195129,"Jl. Gading Serpong Boulevard Kav. S No. 15, Summarecon Gading Serpong 082213293368, Curug Sangereng, Kec. Klp. Dua, Banten 15810, Indonesia","['car_dealer', 'store', 'point_of_interest', 'establishment']"
Wuling Motors kapuk Sales Service,-6.122160699999999,106.7316684,"Lantai 3, Jalan Lingkar luar Barat No.129, Cengkareng Timur, RT.5/RW.1, RT.13/RW.11, Cengkareng Tim., Kecamatan Cengkareng, Kota Jakarta Barat, Daerah Khusus Ibukota Jakarta 11610, Indonesia","['car_dealer', 'store', 'point_of_interest', 'establishment']"
Wuling dealer cibubur,-6.3887931,106.9447009,"Jl.Alternatif Cibubur Km 6 No1 8, Nagrak, Gunung Putri, Nagrak, Kec. Gn. Putri, Bogor, Jawa Barat 16967, Indonesia","['car_dealer', 'store', 'point_of_interest', 'establishment']"
Wuling Motors,-6.214238,106.820624,"Jl. Jend. Sudirman. Kav. 29-31, World Trade Center Tower 1, , Floor 17, RT.4/RW.2, Karet, RT.4/RW.2, Kuningan, Karet, Jakarta, Daerah Khusus Ibukota Jakarta 12920, Indonesia","['point_of_interest', 'establishment']"
Wuling Automobile Dealers Kapuk,-6.122655,106.731184,"Jalan Lingkar Luar 129 2 1, RT.12/RW.11, Cengkareng Tim., Kembangan, Kota Jakarta Barat, Daerah Khusus Ibukota Jakarta 11610, Indonesia","['car_dealer', 'store', 'point_of_interest', 'establishment']"
Wuling Depok,-6.4015982,106.8188946,"Jl. Kartini No.46, Depok, Kec. Pancoran Mas, Kota Depok, Jawa Barat 16431, Indonesia","['point_of_interest', 'establishment']"
Wuling Garuda,-6.161289399999999,106.8466754,"74 Jalan Garuda 1, RT.1/RW.7, 8, Kemayoran, Kec. Kemayoran, Kota Jakarta Pusat, Daerah Khusus Ibukota Jakarta 10620, Indonesia","['car_dealer', 'store', 'point_of_interest', 'establishment']"
PRIMA WULING TOMANG dki brt,-6.184335,106.78968,"Jalan Arjuna Utara No.131, RW.1, RT.1/RW.1, Tomang, Kec. Grogol petamburan, Kota Jakarta Barat, Daerah Khusus Ibukota Jakarta 11470, Indonesia","['car_dealer', 'store', 'point_of_interest', 'establishment']"
Wuling Jayakarta,-6.1395171,106.8197106,"Jl. Pangeran Jayakarta No.33, RT.1/RW.3, Taman Sari, Kec. Sawah Besar, Jakarta, Daerah Khusus Ibukota Jakarta 10730, Indonesia","['car_dealer', 'store', 'point_of_interest', 'establishment']"
Wuling Bekasi Siliwangi,-6.2770161,106.9923891,"Jl. Raya Siliwangi No.5, Bojong Rawalumbu, Rawalumbu, Kota Bks, Jawa Barat 17116, Indonesia","['car_dealer', 'store', 'point_of_interest', 'establishment']"
WULING BOGOR,-6.5759471,106.8072919,"Padjadjaran Road No.100A, Bantarjati, North Bogor, Bogor City, West Java 16153, Indonesia","['car_dealer', 'store', 'point_of_interest', 'establishment']"
Wuling Serang,-6.104379799999999,106.1370583,"Jl. Raya Serang Cilegon Km. 3 No. 6, Drangong Taktakan, Serang, Banten., Drangong, Kec. Taktakan, Kota Serang, Banten 42111, Indonesia","['car_dealer', 'store', 'point_of_interest', 'establishment']"
Wuling Karawaci,-6.215114799999999,106.6193265,"Jl. Imam Bonjol No.10, Panunggangan Bar., Kec. Cibodas, Kota Tangerang, Banten 15138, Indonesia","['car_dealer', 'store', 'point_of_interest', 'establishment']"
Wuling MOTORS Cilandak KKO,-6.3055201,106.81442,"RT.6/RW.8, Ragunan, Pasar Minggu, South Jakarta City, Jakarta 12550, Indonesia","['car_dealer', 'store', 'point_of_interest', 'establishment']"
Wuling Bekasi Summarecon,-6.226768799999999,107.0036661,"Kawasan Automotive Exhibition Center, Jl. Boulevard Selatan, Summarecon Bekasi, Marga Mulya, Kec. Bekasi Utara, Kota Bks, Jawa Barat 17143, Indonesia","['car_dealer', 'store', 'point_of_interest', 'establishment']"
Wuling Pondok Gede,-6.285595199999999,106.8994889,"Jl. Raya Pd. Gede No.49, RT.3/RW.8, Lubang Buaya, Kec. Cipayung, Kota Jakarta Timur, Daerah Khusus Ibukota Jakarta 13810, Indonesia","['car_dealer', 'store', 'point_of_interest', 'establishment']"
Wuling Bintaro,-6.272681,106.726416,"Jl. Menteng Raya Blok FA 2 No. 27, Pd. Ranji, Kec. Pd. Aren, Kota Tangerang Selatan, Banten 12260, Indonesia","['car_dealer', 'store', 'point_of_interest', 'establishment']"
Wuling Karawang,-6.303876,107.305803,"Jl. Tuparev No. 437, RT/04 RW/04, Kel. Karawang Wetan, Kec. Karawang Timur,, Nagasari, West Karawang, Karawang Regency, West Java 41314, Indonesia","['car_dealer', 'store', 'point_of_interest', 'establishment']"
Wuling Kelapa Gading,-6.1742465,106.8969775,"Jl. Kelapa Gading Boulevard Blok DG No. 1, RT.4/RW.17, Klp. Gading Tim., Kec. Klp. Gading, Kota Jkt Utara, Daerah Khusus Ibukota Jakarta 14240, Indonesia","['car_dealer', 'store', 'point_of_interest', 'establishment']"
Wuling Kapuk,-6.1224114,106.7316674,"Jl. Lkr. Luar No.129, RT.10/RW.2, Cengkareng Tim., Kecamatan Cengkareng, Kota Jkt Utara, Daerah Khusus Ibukota Jakarta 10130, Indonesia","['car_dealer', 'store', 'point_of_interest', 'establishment']"
Wuling Cikokol,-6.203613,106.6279421,"Jl. MH. Thamrin No.75, Cikokol, Kec. Tangerang, Kota Tangerang, Banten 15143, Indonesia","['car_dealer', 'store', 'point_of_interest', 'establishment']"
Wuling Titanium Cibubur,-6.3411021,106.8699953,"Jl. Raya Bogor No.21, RT.2/RW.4, Pekayon, Kec. Ps. Rebo, Kota Jakarta Timur, Daerah Khusus Ibukota Jakarta 13710, Indonesia","['store', 'point_of_interest', 'establishment']"
PRIMA WULING CIBUBUR,-6.389037,106.9450848,"Jl. Alternatif Cibubur, Nagrak, Kec. Jatisampurna, Kota Bks, Jawa Barat 16967, Indonesia","['point_of_interest', 'establishment']"
Dealer Wuling Jakarta Barat,-6.1221,106.731762,"Jl. Lkr. Luar Barat No.129, RT.10/RW.2, Cengkareng Bar., Kecamatan Cengkareng, Kota Jakarta Barat, Daerah Khusus Ibukota Jakarta 11730, Indonesia","['car_dealer', 'car_repair', 'store', 'point_of_interest', 'establishment']"
Wuling Bekasi,-6.226863199999999,107.0037898,"Jalan Bulevar Selatan, Marga Mulya, Kec. Bekasi Utara, Kota Bks, Jawa Barat 17143, Indonesia","['car_dealer', 'store', 'point_of_interest', 'establishment']"
Shoroom WULING MOTORS GARUDS,-6.161822,106.847074,"Jl. Kemayoran Timur No.23D, RT.1/RW.7, Kemayoran, Kec. Kemayoran, Kota Jakarta Pusat, Daerah Khusus Ibukota Jakarta 10620, Indonesia","['point_of_interest', 'establishment']"
Wuling jatiwaringin,-6.2756659,106.9126398,"Jatiwaringin, Pondok Gede, Bekasi City, West Java 17411, Indonesia","['point_of_interest', 'establishment']"
Dealer Resmi Wuling Motor,-6.2776552,106.9921358,"Blok Haji Keoi Jl. Raya Siliwangi No.28, Bojong Rawalumbu, Kec. Rawalumbu, Kota Bks, Jawa Barat 17116, Indonesia","['point_of_interest', 'establishment']"
Wuling Cengkareng,-6.134182699999999,106.7306955,"Jakan Lingkar Luar barat No 7, RT.7/RW.14, Cengkareng Tim., Kecamatan Cengkareng, Kota Jakarta Barat, Daerah Khusus Ibukota Jakarta 11730, Indonesia","['car_dealer', 'store', 'point_of_interest', 'establishment']"
WuLing Club Indonesia,-6.303363,106.752685,"Jl. WR Supratman No. 3, Kampung Utan, Ciputat, Tangsel, Cemp. Putih, Kec. Ciputat Tim., Kota Tangerang Selatan, Banten 15412, Indonesia","['point_of_interest', 'establishment']"
Dealer wuling jakarta(Penjualan),-6.1395919,106.8195526,"Jl. Pangeran Jayakarta No.33, RT.1/RW.3, Taman Sari, Kec. Taman Sari, Jakarta, Daerah Khusus Ibukota Jakarta 11110, Indonesia","['car_dealer', 'store', 'point_of_interest', 'establishment']"
Dealer Wuling Kelapa Gading (3s),-6.174173199999999,106.8969888,"Jalan boulevard Raya blok DG Kelapa gading,Jakarta utara, Daerah khusus ibukota Jakarta 14240, RT.4/RW.17, Klp. Gading Tim., Kec. Klp. Gading, Kota Jkt Utara, Daerah Khusus Ibukota Jakarta 14240, Indonesia","['point_of_interest', 'establishment']"
Penjualan wuling margahayu bekasi,-6.254614999999999,107.0096553,"Margahayu, Bekasi Timur, Bekasi City, West Java 17113, Indonesia","['car_dealer', 'store', 'point_of_interest', 'establishment']"
Wuling Tangerang,-6.204918300000001,106.604244,"jln raya boulevard Kav s no 15, Cibodas Baru, Kec. Cibodas, Kota Tangerang, Banten 15821, Indonesia","['car_dealer', 'store', 'point_of_interest', 'establishment']"
Wuling Cimone,-6.186440699999999,106.6085099,"Jl. Gatot Subroto No.km 3, Cimone, Kec. Karawaci, Kota Tangerang, Banten 15114, Indonesia","['car_dealer', 'store', 'point_of_interest', 'establishment']"
Wuling Lubang Buaya,-6.288189999999999,106.905928,"Jl. Lubang Buaya No.17, RT.11/RW.9, Lubang Buaya, Kec. Cipayung, Kota Jakarta Timur, Daerah Khusus Ibukota Jakarta 13810, Indonesia","['point_of_interest', 'establishment']"
WULING GADING SERPONG,-6.2584034,106.6194911,"Jl. Boulevard Gading Serpong Kav. S No. 15 Sumarecon Gading, Serpong, Tangerang, Banten 15821, Indonesia","['car_dealer', 'store', 'point_of_interest', 'establishment']"
Wuling Motor Kalimalang,-6.2477614,106.9166585,"Jl. Raya Kalimalang No 20A, Duren Sawit, Kalimalang, RT.9/RW.7, Pondok Bambu, Duren Sawit, East Jakarta City, Jakarta 13440, Indonesia","['car_dealer', 'store', 'point_of_interest', 'establishment']"
Wuling Tebet,-6.233201299999999,106.8447339,"Jl. Prof. DR. Soepomo No.30, RT.13/RW.2, Tebet Bar., Kec. Tebet, Kota Jakarta Selatan, Daerah Khusus Ibukota Jakarta 12810, Indonesia","['car_dealer', 'store', 'point_of_interest', 'establishment']"
